{
  "reportVersion": 1,
  "toolVersion": "0.1.0",
  "generatedAt": "2026-10-09T00:55:43.690Z",
  "mode": "demo",
  "scope": {
    "dbSchemas": [
      "public"
    ],
    "defaultSchema": "public",
    "rules": [
      "DBP001",
      "DBP002",
      "DBP003",
      "DBP004",
      "DBP005",
      "DBP006"
    ]
  },
  "prisma": {
    "ormMajorAssumed": 7,
    "inputKind": "directory",
    "files": [
      {
        "path": "base.prisma",
        "sha256": "897280f473388eb830751372b82c474720e8ce0900dc070349eefe729c3c67ad",
        "bytes": 191
      },
      {
        "path": "organization.prisma",
        "sha256": "682f82b2659f27b4fda83fa5dc02ab3db056b00675d96343a14ea39baf2255df",
        "bytes": 158
      },
      {
        "path": "reporting.prisma",
        "sha256": "eaf8e279dabd9668c6eca0ace28e0694493abdd1c6974ab217269394d40f760a",
        "bytes": 1301
      }
    ],
    "skipped": [],
    "datasource": {
      "found": true,
      "provider": "postgresql",
      "relationMode": "foreignKeys",
      "relationModeSource": "default",
      "schemas": null
    },
    "counts": {
      "models": 3,
      "views": 0,
      "enums": 0,
      "relations": 2
    },
    "diagnostics": []
  },
  "database": {
    "source": "demo",
    "snapshotOrigin": "synthetic",
    "collectedAt": "2026-01-15T09:00:00.000Z",
    "serverVersion": "16.4",
    "requestedSchemas": [
      "public"
    ],
    "schemasFound": [
      "public"
    ],
    "collectionComplete": true,
    "gaps": [],
    "note": "Built-in synthetic demo metadata; no database was contacted."
  },
  "result": {
    "status": "mismatch_found",
    "exitCode": 1,
    "summary": "2 check(s) found confirmed mismatches, grouped into 1 root-cause group(s).",
    "disclaimer": "Results cover only the supported checks listed in this report, evaluated against the collected metadata. They are not a guarantee that the database as a whole is correct, that data is consistent, or that any migration is safe."
  },
  "checks": [
    {
      "id": "DBP001:relation MonthlySnapshot.organization",
      "ruleId": "DBP001",
      "subject": "relation MonthlySnapshot.organization",
      "status": "not_applicable",
      "evidence": [
        {
          "kind": "prisma",
          "file": "reporting.prisma",
          "line": 8,
          "column": 3,
          "detail": "MonthlySnapshot.organization @relation(fields: [organizationId], references: [id])"
        },
        {
          "kind": "prisma",
          "file": "organization.prisma",
          "line": 4,
          "column": 3,
          "detail": "Organization.snapshots is a list (1:n)"
        }
      ],
      "reasonCode": "not_one_to_one",
      "reason": "relation is 1:n"
    },
    {
      "id": "DBP001:relation SnapshotSummary.snapshot",
      "ruleId": "DBP001",
      "subject": "relation SnapshotSummary.snapshot",
      "status": "fail",
      "evidence": [
        {
          "kind": "prisma",
          "file": "reporting.prisma",
          "line": 25,
          "column": 3,
          "detail": "SnapshotSummary.snapshot @relation(fields: [organizationId, month, snapshotId], references: [organizationId, month, snapshotId])"
        },
        {
          "kind": "prisma",
          "file": "reporting.prisma",
          "line": 9,
          "column": 3,
          "detail": "MonthlySnapshot.summary is not a list (1:1)"
        }
      ],
      "reasonCode": "one_to_one_without_unique_declaration",
      "findingId": "DBP001-29c4232b56"
    },
    {
      "id": "DBP002:id MonthlySnapshot(organizationId, month, snapshotId)",
      "ruleId": "DBP002",
      "subject": "id MonthlySnapshot(organizationId, month, snapshotId)",
      "status": "pass",
      "evidence": [
        {
          "kind": "prisma",
          "file": "reporting.prisma",
          "line": 11,
          "column": 3,
          "detail": "@@id on [organizationId, month, snapshotId]"
        },
        {
          "kind": "database",
          "object": "public.monthly_snapshots",
          "detail": "primary key monthly_snapshots_pkey on (organization_id, month, snapshot_id) guarantees uniqueness of (organization_id, month, snapshot_id)",
          "constraint": "monthly_snapshots_pkey",
          "columns": [
            "organization_id",
            "month",
            "snapshot_id"
          ]
        }
      ]
    },
    {
      "id": "DBP002:id Organization(id)",
      "ruleId": "DBP002",
      "subject": "id Organization(id)",
      "status": "pass",
      "evidence": [
        {
          "kind": "prisma",
          "file": "organization.prisma",
          "line": 2,
          "column": 31,
          "detail": "@id on [id]"
        },
        {
          "kind": "database",
          "object": "public.organizations",
          "detail": "primary key organizations_pkey on (id) guarantees uniqueness of (id)",
          "constraint": "organizations_pkey",
          "columns": [
            "id"
          ]
        }
      ]
    },
    {
      "id": "DBP002:id SnapshotSummary(id)",
      "ruleId": "DBP002",
      "subject": "id SnapshotSummary(id)",
      "status": "pass",
      "evidence": [
        {
          "kind": "prisma",
          "file": "reporting.prisma",
          "line": 18,
          "column": 26,
          "detail": "@id on [id]"
        },
        {
          "kind": "database",
          "object": "public.snapshot_summaries",
          "detail": "primary key snapshot_summaries_pkey on (id) guarantees uniqueness of (id)",
          "constraint": "snapshot_summaries_pkey",
          "columns": [
            "id"
          ]
        }
      ]
    },
    {
      "id": "DBP003:model MonthlySnapshot",
      "ruleId": "DBP003",
      "subject": "model MonthlySnapshot",
      "status": "pass",
      "evidence": [
        {
          "kind": "prisma",
          "file": "reporting.prisma",
          "line": 2,
          "column": 1,
          "detail": "model MonthlySnapshot maps to table \"monthly_snapshots\""
        },
        {
          "kind": "database",
          "object": "public.monthly_snapshots",
          "detail": "table found with 4 columns"
        }
      ]
    },
    {
      "id": "DBP003:model Organization",
      "ruleId": "DBP003",
      "subject": "model Organization",
      "status": "pass",
      "evidence": [
        {
          "kind": "prisma",
          "file": "organization.prisma",
          "line": 1,
          "column": 1,
          "detail": "model Organization maps to table \"organizations\""
        },
        {
          "kind": "database",
          "object": "public.organizations",
          "detail": "table found with 2 columns"
        }
      ]
    },
    {
      "id": "DBP003:model SnapshotSummary",
      "ruleId": "DBP003",
      "subject": "model SnapshotSummary",
      "status": "pass",
      "evidence": [
        {
          "kind": "prisma",
          "file": "reporting.prisma",
          "line": 17,
          "column": 1,
          "detail": "model SnapshotSummary maps to table \"snapshot_summaries\""
        },
        {
          "kind": "database",
          "object": "public.snapshot_summaries",
          "detail": "table found with 6 columns"
        }
      ]
    },
    {
      "id": "DBP004:relation MonthlySnapshot.organization",
      "ruleId": "DBP004",
      "subject": "relation MonthlySnapshot.organization",
      "status": "pass",
      "evidence": [
        {
          "kind": "prisma",
          "file": "reporting.prisma",
          "line": 8,
          "column": 3,
          "detail": "MonthlySnapshot.organization @relation(fields: [organizationId], references: [id])"
        },
        {
          "kind": "prisma",
          "file": "organization.prisma",
          "line": 4,
          "column": 3,
          "detail": "Organization.snapshots is a list (1:n)"
        },
        {
          "kind": "database",
          "object": "public.monthly_snapshots",
          "detail": "foreign key monthly_snapshots_organization_id_fkey (organization_id) -> public.organizations(id)",
          "constraint": "monthly_snapshots_organization_id_fkey",
          "columns": [
            "organization_id"
          ]
        }
      ]
    },
    {
      "id": "DBP004:relation SnapshotSummary.snapshot",
      "ruleId": "DBP004",
      "subject": "relation SnapshotSummary.snapshot",
      "status": "pass",
      "evidence": [
        {
          "kind": "prisma",
          "file": "reporting.prisma",
          "line": 25,
          "column": 3,
          "detail": "SnapshotSummary.snapshot @relation(fields: [organizationId, month, snapshotId], references: [organizationId, month, snapshotId])"
        },
        {
          "kind": "prisma",
          "file": "reporting.prisma",
          "line": 9,
          "column": 3,
          "detail": "MonthlySnapshot.summary is not a list (1:1)"
        },
        {
          "kind": "database",
          "object": "public.snapshot_summaries",
          "detail": "foreign key snapshot_summaries_snapshot_fkey (organization_id, month, snapshot_id) -> public.monthly_snapshots(organization_id, month, snapshot_id)",
          "constraint": "snapshot_summaries_snapshot_fkey",
          "columns": [
            "organization_id",
            "month",
            "snapshot_id"
          ]
        }
      ]
    },
    {
      "id": "DBP005:relation MonthlySnapshot.organization",
      "ruleId": "DBP005",
      "subject": "relation MonthlySnapshot.organization",
      "status": "not_applicable",
      "evidence": [
        {
          "kind": "prisma",
          "file": "reporting.prisma",
          "line": 8,
          "column": 3,
          "detail": "MonthlySnapshot.organization @relation(fields: [organizationId], references: [id])"
        },
        {
          "kind": "prisma",
          "file": "organization.prisma",
          "line": 4,
          "column": 3,
          "detail": "Organization.snapshots is a list (1:n)"
        }
      ],